{
  "name": "HubSpot MCP Server",
  "vendor": "HubSpot",
  "category": "crm",
  "description": "MCP server for HubSpot CRM. Agents can manage contacts, companies, deals, tickets, and run marketing automation workflows.",
  "agent_native_score": 4,
  "protocols": ["MCP", "REST API"],
  "capabilities": ["manage-contacts", "manage-deals", "create-tickets", "email-sequences", "reporting"],
  "interaction_model": "autonomous",
  "auth": "API key / OAuth",
  "pricing": "freemium",
  "open_source": false,
  "url": "https://www.hubspot.com",
  "source": "https://developers.hubspot.com/docs/api/overview",
  "verified": true,
  "last_verified": "2026-03-20",
  "tags": ["crm", "marketing", "sales", "mcp"]
}
