{
  "name": "Slack MCP Server",
  "vendor": "Slack / Community",
  "category": "messaging",
  "description": "MCP server for Slack workspace management. Agents can send messages, read channels, search history, manage users, and react to events.",
  "agent_native_score": 4,
  "protocols": ["MCP", "REST API", "webhooks"],
  "capabilities": ["send-message", "read-messages", "search", "channel-management", "react", "file-upload"],
  "interaction_model": "autonomous",
  "auth": "OAuth",
  "pricing": "free (via Slack API)",
  "open_source": true,
  "url": "https://slack.com/intl/en-us/help/articles/api",
  "github": "https://github.com/modelcontextprotocol/servers/tree/main/src/slack",
  "verified": true,
  "last_verified": "2026-03-20",
  "tags": ["messaging", "slack", "mcp", "workspace"]
}
